{
  "governanceId": "AI-GOV-001",
  "riskClass": "High",
  "approvalStatus": "Approved",
  "approvingAuthority": "Model Validator",
  "accountableAuthority": "Risk Manager",
  "responsibleParty": "ML Engineer",
  "consultedParties": ["Compliance", "Business Owner"],
  "informedParties": ["Internal Auditor"],
  "humanOversightRequired": true,
  "exceptionRequired": false,
  "policyReferences": ["EMAS Module 29", "Module 24 precedence"],
  "sodProfile": {
    "approverMustDifferFromAuditor": true,
    "developerMustDifferFromValidator": true,
    "deployerMustDifferFromSoleApprover": true
  },
  "effectiveFrom": "2026-09-14T00:00:00.000Z",
  "effectiveTo": null,
  "notes": "Standalone governance example for AI-CAP-001."
}
